<?xml version="1.0" encoding="UTF-8"?>
<studentlist xmlns:xsi="http://www.w3.org/2001/XMLSchema-instance" xsi:noNamespaceSchemaLocation="student.xsd">
    <student>
        <id>66</id>
        <regno>1920</regno>
        <name>Nikhil</name>
        <avg>98</avg>
        <dob>2002-05-27</dob>
        <time>02:00:00</time>
        <mobileno>456456</mobileno>
        <distinction>Pass</distinction>
    </student>
    <student>
        <id>66</id>
        <regno>1920</regno>
        <name>Nikhil</name>
        <avg>98</avg>
        <dob>2002-05-27</dob>
        <time>02:00:00</time>
        <mobileno>456456</mobileno>
        <distinction>Pass</distinction>
    </student>
    <student>
        <id>66</id>
        <regno>1920</regno>
        <name>Nikhil</name>
        <avg>98</avg>
        <dob>2002-05-27</dob>
        <time>02:00:00</time>
        <mobileno>456456</mobileno>
        <distinction>Pass</distinction>
    </student>
    <student>
        <id>66</id>
        <regno>1920</regno>
        <name>Nikhil</name>
        <avg>98</avg>
        <dob>2002-05-27</dob>
        <time>02:00:00</time>
        <mobileno>456456</mobileno>
        <distinction>Pass</distinction>
    </student>
    <student>
        <id>66</id>
        <regno>1920</regno>
        <name>Nikhil</name>
        <avg>98</avg>
        <dob>2002-05-27</dob>
        <time>02:00:00</time>
        <mobileno>456456</mobileno>
        <distinction>Pass</distinction>
    </student>
</studentlist>